localhost,eventos,CargaInicialPaginaEventos,consultarSitiosWeb,SELECT,diewebsiten,sitiosweb,1,Consultar los sitios web existentes,"SELECT sitioweb FROM diewebsiten.sitiosweb;",,"['sitioweb']"
localhost,eventos,ConsultarInfoSitioWeb,consultarPaginasSitioWeb,SELECT,diewebsiten,paginas,1,Consultar las páginas de un sitio web,"SELECT pagina FROM diewebsiten.paginas WHERE sitioweb = ?;","['sitioweb']","['pagina']"
localhost,eventos,ConsultarInfoSitioWeb,consultarBasesDeDatosSitioWeb,SELECT,diewebsiten,sitiosweb,2,Consultar las bases de datos a las que un sitio web puede tener acceso,"SELECT keyspaces FROM diewebsiten.sitiosweb WHERE sitioweb = ?;","['sitioweb']","['keyspaces']"
localhost,eventos,ConsultarInfoBaseDeDatos,consultarTablasBasesDeDatos,SELECT,diewebsiten,transacciones_por_tabla,1,Consultar las tablas que contiene una base de datos para el tipo de transacción seleccionado,"SELECT tabla FROM diewebsiten.transacciones_por_tabla WHERE columnfamily_name = ? AND tipotransaccion = ?;","['columnfamily_name', 'tipotransaccion']","['tabla']"
localhost,eventos,ConsultarInfoTabla,consultarInfoTabla,SELECT,system,schema_columnfamilies,1,Consultar toda la información de la tabla seleccionada,"SELECT key_aliases, column_aliases FROM system.schema_columnfamilies WHERE columnfamily_name = ? AND keyspace_name = ?;","['keyspace_name', 'columnfamily_name']","['key_aliases','column_aliases']"
localhost,eventos,ConsultarInfoTabla,consultarValidacionesColumnas,SELECT,diewebsiten,diccionario_columnas,2,Consultar las validaciones de cada columna de la tabla seleccionada,"SELECT column_name, grupovalidacion FROM diewebsiten.columnas WHERE keyspace_name = ? AND columnfamily_name = ?;","['keyspace_name', 'columnfamily_name']","['column_name', 'grupovalidacion']"
localhost,eventos,ConsultarInfoTabla,consultarTiposColumnas,SELECT,system,schema_columns,3,"Consultar el tipo de columna (partitionKey, clusteringColumn, secondaryIndex ó regular), de cada columna de la tabla seleccionada","SELECT column_name, type FROM system.schema_columns WHERE columnfamily_name = ? AND keyspace_name = ?;","['keyspace_name', 'columnfamily_name']","['column_name', 'type']"
localhost,eventos,ConsultarInfoTabla,consultarTiposTransacciones,SELECT,diewebsiten,transacciones_por_tabla,4,Consultar los tipos de transacciones disponibles,"SELECT tipotransaccion FROM diewebsiten.transacciones_por_tabla WHERE columnfamily_name = ? AND keyspace_name = ?;","['keyspace_name', 'columnfamily_name']","['tipotransaccion']"
localhost,eventos,CrearEvento,crearEvento,INSERT,diewebsiten,eventos,1,Crear un nuevo evento para una página de un sitio web,"INSERT INTO diewebsiten.eventos (basededatos, descripcion, evento, orden, pagina, sentenciaCQL, sitioweb, tabla, tipotransaccion, transaccion) VALUES (?,?,?,?,?,?,?,?,?,?);","['basededatos', 'descripcion', 'evento', 'orden', 'pagina', 'sentenciaCQL', 'sitioweb', 'tabla', 'tipotransaccion', 'transaccion']",