localhost,localhost,SW,Die Websiten,Sitio web Die Websiten,"{'diewebsiten', 'miradorhumadea', 'system'}"
miradorhumadea.com,miradorhumadea.com,SW,Mirador Humadea,Sitio Web Mirador Humadea,"{'miradorhumadea'}"
localhost,index,PAG,Home,Página de Inicio Die Websiten,
miradorhumadea.com,index,PAG,Inicio,Página de Inicio Mirador Humadea,
miradorhumadea.com,quienes_somos,PAG,Quienes Somos,Reseña histórica y acerca de nosotros,
localhost,login,PAG,Iniciar sesión,Inicio de sesión de un usuario registrado en Die Websiten,
localhost,elementos/menu1,ELEM,Menu 1 ,Menu 1,